{
 "session_id": "s004",
 "tier": "easy",
 "dontcare_inside_instances": true,
 "action_t": [
  6.96,
  9.94,
  11.1,
  12.35,
  48.04,
  50.53,
  52.43,
  54.23,
  57.85,
  58.93,
  63.63,
  67.42,
  99.11,
  102.92,
  105.83,
  155.08,
  159.08,
  162.66,
  166.16,
  166.82,
  170.71,
  173.27,
  175.6,
  178.39,
  179.89,
  182.44,
  183.59,
  185.14,
  217.89,
  219.57,
  222.79,
  226.34,
  285.38,
  287.22,
  289.92,
  293.5,
  295.04,
  299.01,
  303.21,
  306.08,
  310.94,
  328.76,
  332.36,
  335.29,
  338.75,
  372.05,
  375.1,
  376.33,
  378.81,
  382.54,
  386.87,
  390.63,
  423.85,
  425.53,
  491.29,
  494.09,
  497.0,
  504.45,
  506.55,
  508.46,
  511.77,
  513.58,
  547.43,
  548.97,
  553.73,
  556.69,
  597.04,
  598.81,
  606.54,
  1297.77,
  1301.36,
  1304.64,
  1307.78,
  1312.36,
  1905.1,
  1910.96,
  1914.02
 ],
 "opportunities": [
  {
   "opportunity_id": "s004-op0",
   "template_id": "us.megabus:track_bus_by_service_number",
   "site": "us.megabus",
   "name": "Track bus by service number",
   "description": "Track a bus using service number {service_number}",
   "parameters": [
    "service_number"
   ],
   "steps": [
    "Click Check my bus",
    "Click Track my bus",
    "Open Service Number tab",
    "Type the service number",
    "Select suggestion/submit"
   ],
   "observed_seconds": 61.8,
   "instances": [
    {
     "task_id": "ab139e9d-eb99-47f7-8d0b-f93479fadadf",
     "task": "Track a bus using service number 5456165184.",
     "site": "us.megabus",
     "spans": [
      [
       217.89,
       226.34
      ]
     ],
     "seqs": [
      28,
      29,
      30,
      31
     ],
     "seconds": 26.5,
     "values": {
      "service_number": "5456165184"
     }
    },
    {
     "task_id": "7eff6c15-bab6-4ce4-abb8-72619f593ea1",
     "task": "Track my bus with service number SE4.",
     "site": "us.megabus",
     "spans": [
      [
       423.85,
       425.53
      ],
      [
       547.43,
       556.69
      ]
     ],
     "seqs": [
      52,
      53,
      62,
      63,
      64,
      65
     ],
     "seconds": 35.3,
     "values": {
      "service_number": "SE4"
     }
    }
   ]
  },
  {
   "opportunity_id": "s004-op1",
   "template_id": "resy:book_special_event_tickets",
   "site": "resy",
   "name": "Book special event tickets",
   "description": "Book {tickets} tickets for a special event/experience in {city} on {date}",
   "parameters": [
    "tickets",
    "city",
    "date"
   ],
   "steps": [
    "Select city",
    "Open Special Events & Experiences",
    "Open the event",
    "Select ticket count",
    "Choose time/ticket option",
    "Click Reserve Now"
   ],
   "observed_seconds": 73.9,
   "instances": [
    {
     "task_id": "5f09e15c-c987-4bdb-ab6e-5db39b18317d",
     "task": "Book 3 tickets for a Special Event or Experience in Miami on may 4",
     "site": "resy",
     "spans": [
      [
       285.38,
       310.94
      ]
     ],
     "seqs": [
      32,
      33,
      34,
      35,
      36,
      37,
      38,
      39,
      40
     ],
     "seconds": 40.6,
     "values": {
      "tickets": "3",
      "city": "Miami",
      "date": "May 4"
     }
    },
    {
     "task_id": "b1055658-7993-448c-9af6-a722cf69ff97",
     "task": "Make a reservation for the next restaurant-related event, only 1 ticket is needed.",
     "site": "resy",
     "spans": [
      [
       1297.77,
       1312.36
      ]
     ],
     "seqs": [
      69,
      70,
      71,
      72,
      73
     ],
     "seconds": 33.3,
     "values": {
      "tickets": "1",
      "city": "",
      "date": "next event"
     }
    }
   ]
  },
  {
   "opportunity_id": "s004-op2",
   "template_id": "nps.gov:find_park_by_state_and_view_section",
   "site": "nps.gov",
   "name": "Find park by state and open park section",
   "description": "Use Find a Park by State, pick {state}, and open a section link (e.g. {section}) for the park {park}.",
   "parameters": [
    "state",
    "park",
    "section"
   ],
   "steps": [
    "Click Find a Park by State",
    "Click the state {state}",
    "Locate the park {park} in the results",
    "Click the section link {section} (Current Conditions, Basic Information, National Heritage Area)"
   ],
   "observed_seconds": 61.9,
   "instances": [
    {
     "task_id": "bef473f1-82a1-4359-a2c0-59b6dc2f6abb",
     "task": "Find a park in Alaska that is also a National Heritage Area.",
     "site": "nps.gov",
     "spans": [
      [
       6.96,
       12.35
      ]
     ],
     "seqs": [
      0,
      1,
      2,
      3
     ],
     "seconds": 15.8,
     "values": {
      "state": "Alaska",
      "park": "Kenai Mountains-Turnagain Arm National Heritage Area",
      "section": "National Heritage Area"
     }
    },
    {
     "task_id": "612653f8-defe-41be-ae48-26ed859d98ca",
     "task": "Locate Dry Tortugas in the state of Florida and find out the Current Conditions.",
     "site": "nps.gov",
     "spans": [
      [
       99.11,
       105.83
      ]
     ],
     "seqs": [
      12,
      13,
      14
     ],
     "seconds": 25.1,
     "values": {
      "state": "Florida",
      "park": "Dry Tortugas",
      "section": "Current Conditions"
     }
    },
    {
     "task_id": "6eeaa528-88a8-416f-94f2-ae1425d9c4a3",
     "task": "Search for a park in the state of California called Castle Mountains National Monument and find out it's Basic Information.",
     "site": "nps.gov",
     "spans": [
      [
       597.04,
       606.54
      ]
     ],
     "seqs": [
      66,
      67,
      68
     ],
     "seconds": 21.0,
     "values": {
      "state": "California",
      "park": "Castle Mountains National Monument",
      "section": "Basic Information"
     }
    }
   ]
  }
 ],
 "negatives": [
  {
   "task_id": "1bb8d48f-dac7-472d-b2b2-651ab184baf2",
   "task": "Look for a hybrid job at Resy in software development, if the job is open apply immediately.",
   "site": "resy",
   "spans": [
    [
     48.04,
     67.42
    ]
   ],
   "seqs": [
    4,
    5,
    6,
    7,
    8,
    9,
    10,
    11
   ],
   "seconds": 29.1,
   "kind": "one_off"
  },
  {
   "task_id": "1c6bfd10-4dcb-4a5c-bb2d-922ff9f20087",
   "task": "Look for an English language book on roman empire history in the Kindle store released in the last 90 days, it should be displayed according to its latest publication date, and add the top result to the shopping list.",
   "site": "amazon",
   "spans": [
    [
     155.08,
     185.14
    ]
   ],
   "seqs": [
    15,
    16,
    17,
    18,
    19,
    20,
    21,
    22,
    23,
    24,
    25,
    26,
    27
   ],
   "seconds": 47.8,
   "kind": "distractor"
  },
  {
   "task_id": "7b5b2188-afd4-4279-b738-c37a1b5f2142",
   "task": "Find a list of available opportunities for a volunteer event for year 2023",
   "site": "nps.gov",
   "spans": [
    [
     328.76,
     338.75
    ]
   ],
   "seqs": [
    41,
    42,
    43,
    44
   ],
   "seconds": 22.3,
   "kind": "one_off"
  },
  {
   "task_id": "644b7bed-b5fb-4090-b04f-a669d41ac93a",
   "task": "Find the schedule of the East Boston ferry, check connections, and fares  and download the pdf schedule.",
   "site": "mbta",
   "spans": [
    [
     372.05,
     390.63
    ]
   ],
   "seqs": [
    45,
    46,
    47,
    48,
    49,
    50,
    51
   ],
   "seconds": 33.6,
   "kind": "one_off"
  },
  {
   "task_id": "ad0369b6-cfd5-4555-bb4f-d84a942be555",
   "task": "Order the cheapest climbing shoes in today's deals.",
   "site": "rei",
   "spans": [
    [
     491.29,
     513.58
    ]
   ],
   "seqs": [
    54,
    55,
    56,
    57,
    58,
    59,
    60,
    61
   ],
   "seconds": 38.4,
   "kind": "distractor"
  },
  {
   "task_id": "f61456ed-3cc2-41a0-b79c-56737515fac9",
   "task": "Open the photo gallery for Tsiakkos & Charcoal.",
   "site": "resy",
   "spans": [
    [
     1905.1,
     1914.02
    ]
   ],
   "seqs": [
    74,
    75,
    76
   ],
   "seconds": 29.9,
   "kind": "one_off"
  }
 ]
}